{
  "schema_version": 1,
  "contract": "PROGRESSIVE-PASS2-RESULT-V1",
  "run_start_anchor_commit": "0a1fd55e46646a4b41203b08ddd83a2cc1dd7cd8",
  "run_start_authority_commit": "21b1d01477d15a9f87c1e0231afbf768f5d42b59",
  "run_started_at_utc": "2026-09-29T11:25:32+00:00",
  "semantic_generation_id": "d21e7d0b38be9d16dbd931900610ff8603715150eec3d0e666f5c84a93e52408",
  "profile_pin_sha256": "95561ab1f3e432b35d242ed3d90e2600640f2c68a46c47813ca11f6b8a722551",
  "work_mode": "normal_first_pass",
  "recovery_authorization_id": null,
  "recovery_reason": null,
  "recovery_condition_binding": null,
  "work_id": "e14278bc0ef4e1b3243fff08021ca0b80c7231c0e88442348f52d69cacbe9010",
  "family_id": "game:1416230",
  "taste_subject_key": "App_1416230",
  "appid": "1416230",
  "taste_fingerprint": "bb9d9697ab099ae704df8c0e170ffc7cbf2c3cec296c8e174ce8748cbbc51234",
  "candidate_context_sha256": "b285b81f755910126f4b6459167abfbdae8fc9d7078bc78264bc80d992620b1a",
  "dossier_content_sha256": "ebea7102cc09b5ea4d62169edd806a939aa5396f8e76d608b622ec6bef774a42",
  "dossier_compatibility_binding": {
    "evidence_contract_schema": "TASTE-STEAM-REVIEW-DOSSIER-WEB-EVIDENCE-CONTRACT-V2",
    "evidence_contract_version": 2,
    "evidence_contract_revision": "github-derived-temporal-classification-2026-09-27",
    "evidence_contract_sha256": "81d3feabea2f84f1605e82cae3f0f7c0a0f268c40a104ab01d5163d36788faed",
    "worker_schema": "TASTE-STEAM-REVIEW-DOSSIER-WORKER-SCHEMA-V2",
    "worker_schema_version": 2,
    "worker_schema_revision": "github-derived-temporal-classification-2026-09-27",
    "worker_schema_sha256": "3bc3486627f7a5eed3ab4c00fef8ef563550a6fbd83232fdccb1ec59fa6a2986",
    "dossier_schema": "TASTE-STEAM-REVIEW-DOSSIER-V2",
    "dossier_schema_version": 2,
    "worker_prompt_revision": "web-evidence-v2-github-derived-temporal-classification-v1",
    "worker_prompt_sha256": "719722e85584c32bf10f877cdd19465dfc74a40a0a0992fe1f5e02ae828ff18d"
  },
  "authorization_id": "7940f0d7d5cf4d964e79055c178184489d4992606152b1412e37fc5993bd3c8f",
  "outcome": "analyzed_fit",
  "fit_level": "moderate",
  "confidence": "medium",
  "positive_evidence": [
    "Tank combat balances accessible handling with meaningful positioning, armor, range and weapon characteristics.",
    "Later tank unlocks materially change speed, armor, handling and firepower, giving progression visible gameplay effects rather than cosmetic rewards.",
    "The compact campaign avoids stretching the starting vehicles indefinitely before stronger machines become available."
  ],
  "taste_factors": {
    "gameplay_mastery": 76,
    "development_variety": 74,
    "structure_pacing_direction": 69,
    "identity_hooks": 64,
    "breadth_of_match": 72
  },
  "base_support_compatible": null,
  "negative_assessment": {
    "status": "completed",
    "evaluated_candidate_refs": [
      {
        "kind": "observation",
        "index": 2
      },
      {
        "kind": "observation",
        "index": 3
      }
    ],
    "findings": [
      {
        "disposition": "caution",
        "risk_code": null,
        "text_ru": "Слабый ИИ союзников и противников уменьшает тактический потенциал: враги бывают пассивными, союзники — медленными, а управление отрядом ограничено.",
        "evidence_refs": [
          {
            "kind": "observation",
            "index": 2
          }
        ]
      },
      {
        "disposition": "caution",
        "risk_code": null,
        "text_ru": "Кампания и набор миссий сравнительно компактны; после открытия техники часть игроков быстро упирается в нехватку новых фронтов, исторических миссий и вариантов командования.",
        "evidence_refs": [
          {
            "kind": "observation",
            "index": 3
          }
        ]
      }
    ]
  }
}
