{
  "schema_version": 1,
  "contract": "PROGRESSIVE-PASS2-RESULT-V1",
  "run_start_anchor_commit": "850fd0ab32ce67271497ae9bfafe80a8ab83fdce",
  "run_start_authority_commit": "f8f8370bf647edf05db79eeb4ec82caeee3d5148",
  "run_started_at_utc": "2026-09-27T17:10:54+00:00",
  "semantic_generation_id": "4596b03979956f78c308551a75fdbe9f432ed3f80925c29b0835bdb052222033",
  "profile_pin_sha256": "cb64c290e037aade65d4269ae2ebe54b681367cad899d7dd9c9838603370f358",
  "work_id": "cb15c4d494abc70f9780ce03f9cf9b6efb2bb9c0329a6c91a8942f6c2ce0c995",
  "family_id": "game:1173820",
  "taste_subject_key": "App_1173820",
  "appid": "1173820",
  "taste_fingerprint": "4b28023e2bc590b09f70efee84c47dbb0d099307033512c87638bb1eb46a9d4f",
  "candidate_context_sha256": "7e7663621bdca452fe9fa72b18b5cf532251c0430ef9d44c5dff7c2462a121a4",
  "dossier_content_sha256": "a5d78b8539b97e6e6b103583d1af277ab30ecd2f0ffcccd83edbe26be5a4ba59",
  "dossier_compatibility_binding": {
    "evidence_contract_schema": "TASTE-STEAM-REVIEW-DOSSIER-WEB-EVIDENCE-CONTRACT-V2",
    "evidence_contract_version": 2,
    "evidence_contract_revision": "github-derived-temporal-classification-2026-09-27",
    "evidence_contract_sha256": "81d3feabea2f84f1605e82cae3f0f7c0a0f268c40a104ab01d5163d36788faed",
    "worker_schema": "TASTE-STEAM-REVIEW-DOSSIER-WORKER-SCHEMA-V2",
    "worker_schema_version": 2,
    "worker_schema_revision": "github-derived-temporal-classification-2026-09-27",
    "worker_schema_sha256": "3bc3486627f7a5eed3ab4c00fef8ef563550a6fbd83232fdccb1ec59fa6a2986",
    "dossier_schema": "TASTE-STEAM-REVIEW-DOSSIER-V2",
    "dossier_schema_version": 2,
    "worker_prompt_revision": "web-evidence-v2-github-derived-temporal-classification-v1",
    "worker_prompt_sha256": "719722e85584c32bf10f877cdd19465dfc74a40a0a0992fe1f5e02ae828ff18d"
  },
  "authorization_id": "011a5097f8fb05763a6193fbfe3ebd5caa5d644e0ce141c03714d477d0346391",
  "work_mode": "normal_first_pass",
  "recovery_authorization_id": null,
  "recovery_reason": null,
  "recovery_condition_binding": null,
  "outcome": "analyzed_fit",
  "fit_level": "strong",
  "confidence": "high",
  "positive_evidence": [
    "The large ensemble has distinct personal combat commands while Magicite provides shared magic learning and build customization, creating meaningful party variety and development across the campaign.",
    "Character arcs, darker dramatic turns and distributed narrative attention make story and cast a central strength, closely matching the profile's high value on memorable characters and strong authored identity.",
    "The rearranged soundtrack, refreshed pixel presentation and expanded set pieces such as the opera reinforce the game's distinctive atmosphere instead of relying only on mechanics.",
    "Customization is substantial enough to support experimentation, while the main trade-off is optional grinding and some late-game repetition rather than a lack of development."
  ],
  "taste_factors": {
    "gameplay_mastery": 81,
    "development_variety": 86,
    "structure_pacing_direction": 83,
    "identity_hooks": 94,
    "breadth_of_match": 89
  },
  "base_support_compatible": null
}
